<?xml version="1.0" encoding="UTF-8"?>

<system
xmlns:xsi="http://www.w3.org/2001/XMLSchema-instance"
xsi:noNamespaceSchemaLocation="system.xsd"
id='123'>
<!-- xsi:schemaLocation="http://www.fraunhofer.de/isst/automotive/stars/reqmon/dsl/mapping/system system.xsd" -->

	<name></name>
	<version></version>
	<description></description>
	<message>
		<name>MA</name>
		<allocation>
			<bit_size>1024</bit_size>
			<location>X</location>
		</allocation>
		<data_objects>
			<signal_object>
				<ref>1</ref>
			</signal_object>
			<signal_object>
				<ref>2</ref>
			</signal_object>
		</data_objects>
	</message>
	<signal id='1'>
		<name>SA</name>
		<description></description>
		<datatype>SYA</datatype>
		<allocation>
			<bit_size>16</bit_size>
			<location>SX1</location>
		</allocation>
		<min_value>0.0</min_value>
		<max_value>100.0</max_value>
		<preferred_value>50.0</preferred_value>
		<step_size>0.5</step_size>
	</signal>
	<signal id='2'>
		<name>SB</name>
		<datatype>SYB</datatype>
		<allocation>
			<bit_size>8</bit_size>
			<location>SX2</location>
		</allocation>
		<min_value>-1.0</min_value>
		<max_value>1.0</max_value>
		<preferred_value>0.0</preferred_value>
		<step_size>0.1</step_size>
	</signal>
	<data_structure id='1'>
		<name></name>
		<description></description>
		<allocation>
			<bit_size>0</bit_size>
			<location>SX</location>
		</allocation>
		<class> 
			<name>CNA</name>
			<inheritance_from>Parent</inheritance_from>
			<attribute>
				<name>ANA1</name>
				<attrType>
					<type>class</type>
				</attrType>
			</attribute>
			<attribute>
				<name>ANA2</name>
				<attrType>
					<type>signal</type>
				</attrType>
			</attribute>
		</class>
		<class> 
			<name>CNB</name>
			<inheritance_from></inheritance_from>
			<attribute>
				<name>ANB1</name>
				<attrType>
					<type>integer</type>
				</attrType>
			</attribute>
			<attribute>
				<name>ANB2</name>
				<attrType>
					<type>float</type>
				</attrType>
			</attribute>
			<attribute>
				<name>ANB3</name>
				<attrType>
					<type>double</type>
				</attrType>
			</attribute>
		</class>
		<class> 
			<name>CNC</name>
			<inheritance_from></inheritance_from>
			<attribute>
				<name>ANC1</name>
				<attrType>
					<type>short</type>
				</attrType>
			</attribute>
			<attribute>
				<name>ANC2</name>
				<attrType>
					<type>string</type>
				</attrType>
			</attribute>
			<attribute>
				<name>ANC3</name>
				<attrType>
					<type>char</type>
				</attrType>
			</attribute>
			<attribute>
				<name>ANC3</name>
				<attrType>
					<type>byte</type>
				</attrType>
			</attribute>
		</class>
		<class>
			<name>CND</name>
			<attribute>
				<name>AND1</name>
				<attrType>
					<newType>
						<name>newType</name>
					</newType>
				</attrType>
			</attribute>
			<attribute>
				<name>AND2</name>
				<attrType>
					<list>
						<type>string</type>
						<type>char</type>
						<type>boolean</type>
				</list>
				</attrType>
			</attribute>
			<attribute>
				<name>AND2</name>
				<attrType>
					<set>
						<type>integer</type>
					</set>
				</attrType>
			</attribute>
		</class>
	</data_structure>
</system>